<?xml version="1.0" encoding="UTF-8" standalone="no"?>
<!DOCTYPE holidays SYSTEM "holidays.dtd">
<!-- 
    This file is from the free xml-holidays project. See also
    https://github.com/jonelo/xml-holidays/
    Thank you for keeping the comment.
-->
<holidays country="CO">
    <!-- http://en.wikipedia.org/wiki/Public_holidays_in_Colombia 
         http://es.wikipedia.org/wiki/Fiestas_de_Colombia -->

    <default language="es"/>

    <holiday>
        <description language="es" name="Año Nuevo"/>
        <description language="en" name="New Year's Day" type="public holiday"/>
        <import id="New Year's Day"/>
    </holiday>
    
    <holiday>
        <description language="es" name="Día de los Reyes Magos"/>
        <description language="en" name="Epiphany" type="public holiday"/>
        <definition>
            <fixed day="6" month="January"/>
            <!--
              Movable holiday: when it does not fall on a Monday,
              the holiday is observed on the following Monday.
            -->
            <condition ifweekday="Tuesday">
                <add days="6"/>
            </condition>
            <condition ifweekday="Wednesday">
                <add days="5"/>
            </condition>
            <condition ifweekday="Thursday">
                <add days="4"/>
            </condition>
            <condition ifweekday="Friday">
                <add days="3"/>
            </condition>
            <condition ifweekday="Saturday">
                <add days="2"/>
            </condition>
            <condition ifweekday="Sunday">
                <add days="1"/>
            </condition>
        </definition>
    </holiday>
    
    
    <holiday>
        <description language="es" name="Día del Maestro"/>
        <description language="en" name="Teacher's Day" type="public holiday"/>
        <definition>
            <fixed day="15" month="May"/>
        </definition>
    </holiday>
    
    <holiday>
        <description language="es" name="Día de San José"/>
        <description language="en" name="Saint Joseph's Day" type="public holiday"/>
        <definition>
            <fixed day="19" month="March"/>
            <!--
              Movable holiday: when they do not fall on a Monday,
              the holiday is observed on the following Monday.
            -->
            <condition ifweekday="Tuesday">
                <add days="6"/>
            </condition>
            <condition ifweekday="Wednesday">
                <add days="5"/>
            </condition>
            <condition ifweekday="Thursday">
                <add days="4"/>
            </condition>
            <condition ifweekday="Friday">
                <add days="3"/>
            </condition>
            <condition ifweekday="Saturday">
                <add days="2"/>
            </condition>
            <condition ifweekday="Sunday">
                <add days="1"/>
            </condition>
        </definition>
    </holiday>
    
    <holiday>
        <description language="en" name="Jueves Santo" type="public holiday"/>
        <import id="Maundy Thursday"/>
    </holiday>
    
    <holiday>
        <description language="es" name="Viernes Santo"/>
        <description language="en" name="Good Friday" type="public holiday"/>
        <import id="Good Friday"/>
    </holiday>
    
    <holiday>
        <description language="en" name="Labor Day" type="public holiday"/>
        <description language="es" name="Primero de Mayo"/>
        <definition>
            <fixed day="1" month="May"/>
        </definition>
    </holiday>
    
    <holiday>
        <description language="es" name="Ascensión"/>
        <description language="en" name="Ascension" type="public holiday"/>
        <import id="Ascension of Jesus"/>
    </holiday>
    
    <holiday>
        <description language="en" name="Corpus Christi" type="public holiday"/>
        <import id="Corpus Christi"/>
    </holiday>
    
    <holiday>
        <description language="es" name="Sagrado Corazón"/>
        <description language="en" name="Sacred Heart" type="public holiday"/>
        <definition>
            <!-- observed the Monday ten weeks and a day after Easter Sunday -->
            <easter/>
            <add days="71"/>
        </definition>
    </holiday>
    
    <holiday>
        <description language="es" name="San Pedro y San Pablo"/>
        <description language="en" name="Saint Peter and Saint Paul" type="public holiday"/>
        <definition>
            <fixed day="29" month="June"/>
            <!--
              Movable holiday: when it does not fall on a Monday,
              the holiday is observed on the following Monday.
            -->
            <condition ifweekday="Tuesday">
                <add days="6"/>
            </condition>
            <condition ifweekday="Wednesday">
                <add days="5"/>
            </condition>
            <condition ifweekday="Thursday">
                <add days="4"/>
            </condition>
            <condition ifweekday="Friday">
                <add days="3"/>
            </condition>
            <condition ifweekday="Saturday">
                <add days="2"/>
            </condition>
            <condition ifweekday="Sunday">
                <add days="1"/>
            </condition>
        </definition>
    </holiday>
    
    <holiday>
        <description language="en" name="Independence Day" type="public holiday"/>
        <definition>
            <fixed day="20" month="July"/>
        </definition>
    </holiday>
    
    <holiday>
        <description language="en" name="Battle of Boyacá" type="public holiday"/>
        <definition>
            <fixed day="7" month="August"/>
        </definition>
    </holiday>
    
    <holiday>
        <description language="es" name="La Asunción"/>
        <description language="en" name="Assumption of Mary" type="public holiday"/>
        <definition>
            <fixed day="15" month="August"/>
            <!--
              Movable holiday: when it does not fall on a Monday,
              the holiday is observed on the following Monday.
            -->
            <condition ifweekday="Tuesday">
                <add days="6"/>
            </condition>
            <condition ifweekday="Wednesday">
                <add days="5"/>
            </condition>
            <condition ifweekday="Thursday">
                <add days="4"/>
            </condition>
            <condition ifweekday="Friday">
                <add days="3"/>
            </condition>
            <condition ifweekday="Saturday">
                <add days="2"/>
            </condition>
            <condition ifweekday="Sunday">
                <add days="1"/>
            </condition>
        </definition>
    </holiday>
    
    <holiday>
        <description language="en" name="Columbus Day" type="public holiday"/>
        <description language="es" name="Día de la Raza"/>
        <definition>
            <fixed day="12" month="October"/>
        </definition>
    </holiday>
    
    <holiday>
        <description language="en" name="All Saints' Day" type="public holiday"/>
        <definition>
            <fixed day="1" month="November"/>
            <!--
              Movable holiday: when it does not fall on a Monday,
              the holiday is observed on the following Monday.
            -->
            <condition ifweekday="Tuesday">
                <add days="6"/>
            </condition>
            <condition ifweekday="Wednesday">
                <add days="5"/>
            </condition>
            <condition ifweekday="Thursday">
                <add days="4"/>
            </condition>
            <condition ifweekday="Friday">
                <add days="3"/>
            </condition>
            <condition ifweekday="Saturday">
                <add days="2"/>
            </condition>
            <condition ifweekday="Sunday">
                <add days="1"/>
            </condition>
        </definition>
    </holiday>
    
    <holiday>
        <description language="en" name="Independence of Cartagena City" type="public holiday"/>
        <definition>
            <fixed day="11" month="November"/>
            <!--
              Movable holiday: when it does not fall on a Monday,
              the holiday is observed on the following Monday.
            -->
            <condition ifweekday="Tuesday">
                <add days="6"/>
            </condition>
            <condition ifweekday="Wednesday">
                <add days="5"/>
            </condition>
            <condition ifweekday="Thursday">
                <add days="4"/>
            </condition>
            <condition ifweekday="Friday">
                <add days="3"/>
            </condition>
            <condition ifweekday="Saturday">
                <add days="2"/>
            </condition>
            <condition ifweekday="Sunday">
                <add days="1"/>
            </condition>
        </definition>
    </holiday>
    
    <holiday>
        <description language="es" name="La Inmaculada Concepción"/>
        <description language="en" name="Immaculate Conception" type="public holiday"/>
        <definition>
            <fixed day="8" month="December"/>
        </definition>
    </holiday>
    
    <holiday>
        <description language="es" name="Navidad"/>
        <description language="en" name="Christmas Day" type="public holiday"/>
        <import id="Christmas Day"/>
    </holiday>
    
    <holiday>
        <description language="en" name="Begin Daylight Saving Time (DST)"/>
        <definition>
            <dst timezone="America/Bogota" action="start"/>
        </definition>
    </holiday>
    
    <holiday>
        <description language="en" name="End Daylight Saving Time (DST)"/>
        <definition>
            <dst timezone="America/Bogota" action="end"/>
        </definition>
    </holiday>
    
</holidays>
